{
  "analysis_id": "einstein-1773453200-tui-migration-topology",
  "assumptions_surfaced": [
    {
      "assumption": "Claude CLI's --output-format stream-json emits NDJSON events that include permission request events, and accepts permission responses via stdin JSON",
      "risk_if_false": "If Claude CLI handles permissions internally (via terminal prompts) rather than through NDJSON events, the entire modal/permission system design fails. The Go TUI would need to either: (a) pipe through terminal I/O for permissions (conflicts with Bubble Tea owning stdin), or (b) use MCP tools for permission mediation (requires MCP server to be the permission authority).",
      "source": "Implicit in migration plan Phase 2 (CLI driver) and Phase 4 (modal system). The plan assumes Go TUI can intercept permission prompts from the NDJSON stream, but this mechanism is never explicitly verified.",
      "validation_method": "Run: `claude --output-format stream-json` interactively. Trigger a tool that requires permission (e.g., Write to a file in default permission mode). Capture ALL NDJSON output and stdin traffic. Document the permission request/response protocol."
    },
    {
      "assumption": "Go MCP SDK (modelcontextprotocol/go-sdk v1.2.0) supports all MCP features that Claude Code CLI uses",
      "risk_if_false": "If go-sdk doesn't support a required MCP feature (e.g., specific transport mode, tool schema format, or streaming protocol), the Go-native MCP server approach fails. Would need to either update go-sdk or keep TS sidecar.",
      "source": "Migration plan rationale table (Section 1): 'Go MCP SDKs lag behind'. Implicitly challenged by go.mod already containing go-sdk v1.2.0.",
      "validation_method": "Enumerate MCP features used by current TS MCP server (tool registration, in-process transport, tool result streaming). Verify each is supported in go-sdk v1.2.0 by checking go-sdk documentation and examples. Create a proof-of-concept Go MCP server with one tool and verify Claude CLI can connect and invoke it."
    },
    {
      "assumption": "The NDJSON stream_event type corresponds to partial/streaming content and can be safely handled as incremental message updates",
      "risk_if_false": "If stream_event has complex semantics (e.g., SSE-style content_block_start/delta/stop with tool streaming), the parser (P2-3) will miss partial content blocks, causing the conversation display to show incomplete or garbled output.",
      "source": "Migration plan CLIEvent struct (P2-1) lists stream_event as a type but provides no handler or struct definition for it.",
      "validation_method": "Capture a real Claude CLI session with --output-format stream-json. Use `tee` to save all NDJSON lines. Count and categorize ALL event types, especially stream_event subtypes. Compare against the 6 types identified in the plan."
    },
    {
      "assumption": "TS sidecar startup latency (500ms-1s) is acceptable and can be mitigated with esbuild bundling",
      "risk_if_false": "If the TUI feels sluggish at startup because it waits for Node.js to initialize, user experience suffers. This is a permanent tax in three-process topology but eliminated entirely in two-process.",
      "source": "Migration plan Risk Register (Section 17).",
      "validation_method": "Benchmark: time `node sidecar/dist/index.js` cold start vs time `./gofortress` native Go start. If \u003e300ms difference, user perception of startup lag is real."
    },
    {
      "assumption": "spawnAgent's process management (PID tracking, SIGTERM/SIGKILL escalation, output buffering) can remain in TS sidecar",
      "risk_if_false": "Keeping process management in TS while the TUI is in Go creates a split-brain problem: Go TUI tracks agent state (for rendering), but TS sidecar tracks process state (PIDs, exit codes). If they disagree (e.g., Go thinks agent is running but TS has already killed it), the agent tree shows stale information.",
      "source": "Migration plan P3-3: 'spawnAgent's process spawning (exec.spawn) stays in the TS sidecar'.",
      "validation_method": "Map all state that must be consistent between Go TUI and TS sidecar. Identify which process is the source of truth for each state field. If more than 3 fields require cross-process synchronization, the split is architecturally unsound."
    },
    {
      "assumption": "Claude CLI stdin accepts line-delimited JSON for user messages in --output-format stream-json mode",
      "risk_if_false": "If Claude CLI expects plain text on stdin (not JSON), the message delivery mechanism needs to change. If it expects a specific JSON schema, that schema must be documented.",
      "source": "Migration plan P2-6: 'Write user messages to CLI stdin as JSON'.",
      "validation_method": "Run Claude CLI with --output-format stream-json. Attempt to send a JSON-formatted message via stdin. Verify it's processed correctly. Try plain text as well. Document the accepted format."
    },
    {
      "assumption": "All 13 old TUI tickets (GOgent-109 to GOgent-121) are fully subsumed by the 56 new tickets",
      "risk_if_false": "If old tickets contain requirements or design decisions not captured in the new plan, features may be lost. Specifically: TUI-CLI-01a (auto-restart logic) is not explicitly present in the new plan. TUI-TELEM-01 (file watchers for telemetry) uses chokidar; the new plan replaces with polling but may lose real-time telemetry updates.",
      "source": "Problem brief: 'reconcile 13 old tickets with 56 new tickets'.",
      "validation_method": "Create a requirements traceability matrix: each old ticket requirement mapped to the specific new ticket that covers it. Flag any unmapped requirements."
    }
  ],
  "conceptual_framework": {
    "description": "This framework analyzes multi-process architectures through three lenses: (1) Failure Mode Combinatorics — each additional process creates multiplicative, not additive, failure scenarios; (2) IPC Tax — every cross-process boundary adds serialization, deserialization, and transport overhead that compounds under load; (3) Goal Alignment — architecture must serve the stated migration objectives, not perpetuate historical accidents. Applied to the three-process topology: the TS sidecar adds 4 unique failure modes, ~2-5ms per modal interaction, and directly contradicts the migration's goal of eliminating Node.js dependency.",
    "framework_name": "Process Topology Complexity Analysis (Distributed Systems First Principles)",
    "key_insights": [
      "Every process boundary is a serialization boundary, a failure boundary, and a deployment boundary. Minimizing process count minimizes all three.",
      "The TS sidecar's value proposition ('tracks Claude Code CLI updates') assumes MCP protocol instability, but MCP is a standardized protocol with an official Go SDK. The instability assumption is unsubstantiated.",
      "The most complex sidecar functionality (spawnAgent) is a TypeScript reimplementation of existing Go code (gogent-team-run, internal/lifecycle/process.go). Maintaining parallel implementations in two languages doubles maintenance cost.",
      "The migration plan's HTTP bridge pattern (localhost HTTP between co-located processes) is an enterprise integration pattern designed for cross-machine communication, applied to a scenario where in-process function calls would suffice.",
      "Process lifecycle coordination complexity grows as O(n²) with process count. Two processes have 1 coordination pair; three processes have 3 coordination pairs. Each pair needs startup ordering, health checking, failure detection, and graceful shutdown logic."
    ]
  },
  "executive_summary": "The three-process topology (Go TUI + TS MCP sidecar + Claude Code CLI) is architecturally over-engineered and self-contradictory: the entire motivation for migrating to Go is single-binary distribution and eliminating Node.js, yet the plan retains a Node.js sidecar as a permanent dependency. The Go MCP SDK (modelcontextprotocol/go-sdk v1.2.0, already in go.mod) can fully replace `createSdkMcpServer` since MCP is a language-agnostic protocol standard. A two-process topology (Go TUI with native MCP + Claude Code CLI) eliminates the HTTP bridge, removes N² process coordination failure modes, and achieves the stated migration goal. The Zustand-to-Elm state translation is low-risk and natural. However, the migration plan critically underspecifies the permission handling mechanism in `--output-format stream-json` mode — the current `canUseTool` callback is an Agent SDK concept that doesn't exist in direct CLI mode, and the plan silently assumes MCP tools will replace it without verifying how Claude CLI actually handles permission prompts in stream-json mode.",
  "first_principles_analysis": {
    "assumptions_challenged": [
      {
        "assumption": "createSdkMcpServer tightly tracks Claude Code CLI updates — Go MCP SDKs lag behind",
        "evidence": "MCP is a protocol standard (modelcontextprotocol.io). The Go SDK (modelcontextprotocol/go-sdk v1.2.0, already in go.mod) is the OFFICIAL Go implementation from the MCP project — not a community fork. It tracks the same protocol specification as the TypeScript SDK. The `createSdkMcpServer` function provides convenience (Zod schema definitions, tool registration), not unique protocol capabilities. Go can register tool handlers with JSON schemas natively. The claim of SDK lag is unsubstantiated — both SDKs implement the same protocol version. The real risk would be Anthropic adding non-standard protocol extensions, which would violate MCP specification.",
        "implication_if_wrong": "If the Go MCP SDK does fully support Claude Code's MCP requirements, the entire rationale for the TS sidecar collapses. The three-process topology becomes unnecessary complexity.",
        "validity": "questionable"
      },
      {
        "assumption": "HTTP bridge is necessary because Bubble Tea owns stdin/stdout",